{
  "schemaVersion": "loc.semantic-action.v1",
  "objectKind": "semantic_action",
  "actionKey": "defracto.conveyor-runner.load-run-manifest.semantic-action.v1",
  "capabilityKey": "json.read.v1",
  "intent": "Load the run manifest.",
  "stableSignature": {
    "algorithm": "sha256",
    "fields": [
      "actionKey",
      "capabilityKey",
      "input",
      "output",
      "failure"
    ],
    "value": "computed-by-resolver-or-registry"
  },
  "input": {
    "context": "$context",
    "graph": "$graph"
  },
  "output": {
    "path": "$graph.load_run_manifest"
  },
  "failure": {
    "onMissingInput": "blocked",
    "blocker": "conveyor_runner_load_run_manifest_blocked"
  }
}
