{
  "schemaVersion": "loc.semantic-action.v1",
  "objectKind": "semantic_action",
  "actionKey": "defracto.shipper.emit-ship-receipt.semantic-action.v1",
  "capabilityKey": "evidence.emit.v1",
  "intent": "Emit ship receipt.",
  "stableSignature": {
    "algorithm": "sha256",
    "fields": [
      "actionKey",
      "capabilityKey",
      "input",
      "output",
      "failure"
    ],
    "value": "computed-by-resolver-or-registry"
  },
  "input": {
    "context": "$context",
    "graph": "$graph"
  },
  "output": {
    "path": "$graph.emit_ship_receipt"
  },
  "failure": {
    "onMissingInput": "blocked",
    "blocker": "shipper_emit_ship_receipt_blocked"
  }
}
