{
  "schemaVersion": "loc.semantic-action.v1",
  "objectKind": "semantic_action",
  "actionKey": "defracto.lane-workers.emit-lane-receipt.semantic-action.v1",
  "capabilityKey": "evidence.emit.v1",
  "intent": "Emit lane receipt for downstream advance.",
  "stableSignature": {
    "algorithm": "sha256",
    "fields": [
      "actionKey",
      "capabilityKey",
      "input",
      "output",
      "failure"
    ],
    "value": "computed-by-resolver-or-registry"
  },
  "input": {
    "context": "$context",
    "graph": "$graph"
  },
  "output": {
    "path": "$graph.emit_lane_receipt"
  },
  "failure": {
    "onMissingInput": "blocked",
    "blocker": "lane_workers_emit_lane_receipt_blocked"
  }
}
